program_name	entry_point	recovered_name	current_public_name	status	notes
Creatures.exe	00408620	FUN_00408620	creatures_registry_write_pair32	verified_slice	Writes the recovered 8-byte pair payload used by EyePosn-style settings
Creatures.exe	00408760	FUN_00408760	creatures_audio_voice_slot_reset	verified_slice	Clears one five-word DirectSound voice slot record back to the idle state
Creatures.exe	00408780	FUN_00408780	creatures_audio_output_create_primary_buffer	verified_slice	Creates the DirectSound device and primary buffer, switches it to stereo 22050 Hz 16-bit PCM, and marks the audio output ready
Creatures.exe	00408960	FUN_00408960	creatures_audio_output_destroy	verified_slice	Runs the DirectSound shutdown chain and optionally releases the owning audio-output object when the low destroy flag is set
Creatures.exe	00408980	FUN_00408980	creatures_audio_output_shutdown	verified_slice	Stops active voices, releases registered owners, drops the primary DirectSound buffer, and clears the ready flags
Creatures.exe	00409020	FUN_00409020	creatures_audio_output_release_registered_streams_and_slots	verified_slice	Releases the registered stream list, notifies the mixer, and then tears down all active voice slots
Creatures.exe	00409050	FUN_00409050	creatures_audio_output_release_registered_streams	verified_slice	Releases every registered stream object and posts the recovered mixer-idle notification
Creatures.exe	004091b0	FUN_004091b0	creatures_audio_output_release_voice_slot	verified_slice	Stops one active DirectSound voice slot, releases its buffer, drops the owner refcount, and decrements the active-voice count
Creatures.exe	00409210	FUN_00409210	creatures_audio_output_release_owner_chain	verified_slice	Releases every active voice tied to one owner and its linked owner before destroying both owner records
Creatures.exe	004092d0	FUN_004092d0	creatures_audio_output_release_registered_owners	verified_slice	Walks the registered owner list through the owner-chain releaser, posts the recovered mixer-idle notification, and clears the owner phase
Creatures.exe	00429000	FUN_00429000	creatures_eye_window_save_position_and_destroy	verified_slice	Saves the current eye-window left and top coordinates into EyePosn and then destroys the eye window through the recovered close callback
Creatures.exe	00429250	FUN_00429250	creatures_registry_bootstrap_main_handler	verified_slice	Initializes the global Creatures registry handler with the recovered Millennium Interactive / Creatures / 1.0 path
Creatures.exe	00420b20	FUN_00420b20	creatures_creature_start_waiting_behavior	verified_slice	Seeds the wait-state behavior scripts, bumps a zero body-variant stage to one, and queues the literal wait script line
Creatures.exe	004224c0	FUN_004224c0	creatures_creature_update_attention_and_growth	verified_slice	Updates orientation and focus state, advances enabled body-variant stages, and triggers refresh or finalization at the stage boundaries
Creatures.exe	00422aa0	FUN_00422aa0	creatures_choose_population_balanced_sex	verified_slice	Chooses the next creature sex by biasing toward the underrepresented non-excluded population
Creatures.exe	00422db0	FUN_00422db0	creatures_creature_refresh_body_assets	verified_slice	Rebuilds the genome/body scratch state, reapplies appearance/runtime data, and selects the final voice asset for the creature
Creatures.exe	004230c0	FUN_004230c0	creatures_creature_rebuild_from_export_genome	verified_slice	Rebuilds a creature body from an imported genome export, regenerating duplicate identities before the placement and global event pass
Creatures.exe	0042d7b0	FUN_0042d7b0	creatures_map_data_archive_load	verified_slice	Loads the fixed-size MapData archive payload with its background gallery binding, up-to-40 room records, 0x105 scanline table, and 100 embedded object slots
